round,reviewer_role,severity,location,comment,owner_agent,resolution_status
round1,reviewer_rigor,BLOCKER,"main.tex:author/abstract/keywords","Submission front matter incomplete (placeholder authors, empty abstract, placeholder keywords).",revision_integrator,resolved_main_front_matter_updated
round1,reviewer_rigor,MAJOR,"sections/06_results.tex; sections/07_discussion.tex; tables/main_results_table.tex","Comparative performance claims require inferential statistics and multiplicity control.",statistical_rigor_agent,resolved_sign_test_holm_and_bootstrap_ci_added
round1,reviewer_rigor,MAJOR,"sections/05_experiments.tex; sections/06_results.tex","Timing methodology under-specified for sub-millisecond claims.",revision_integrator,partially_resolved_timing_protocol_documented_no_new_runs
round1,reviewer_rigor,MAJOR,"sections/04_method.tex; tables/main_results_table.tex; sections/07_discussion.tex","Ranking policy described inconsistently across sections.",revision_integrator,resolved_canonical_ranking_order_harmonized
round1,reviewer_rigor,MAJOR,"appendix/reproducibility_checklist.tex","Appendix checklist contains stale and contradictory compliance statements.",revision_integrator,resolved_checklist_refreshed_with_current_snapshot
round1,reviewer_rigor,MEDIUM,"sections/06_results.tex; sections/07_discussion.tex","Limitation language not fully reflected in claim strength.",revision_integrator,resolved_discussion_reframed_as_descriptive
round1,reviewer_rigor,MEDIUM,"tables/experiment_protocol_table.tex","Protocol table uses invalid python invocation for bash regression script.",revision_integrator,resolved_command_corrected_to_bash
round1,reviewer_rigor,MEDIUM,"sections/05_experiments.tex","Process-management figure has weak scientific payoff in main text.",revision_integrator,resolved_process_figure_deemphasized_removed_from_main
round1,reviewer_rigor,MINOR,"sections/06_results.tex","Results figures omit uncertainty visualization.",statistical_rigor_agent,resolved_runtime_uncertainty_figure_added
round1,reviewer_methods,CRITICAL,"sections/04_method.tex; robotics_maze/src/main.py; robotics_maze/src/maze.py","Per-episode seed policy in manuscript conflicts with executable code path.",revision_integrator,resolved_seed_policy_aligned_to_executable_behavior
round1,reviewer_methods,MAJOR,"sections/04_method.tex; tables/main_results_table.tex; sections/07_discussion.tex","Ranking policy contradictory across manuscript artifacts and generated summary.",revision_integrator,resolved_code_summary_manuscript_ranking_policy_aligned
round1,reviewer_methods,MAJOR,"tables/experiment_protocol_table.tex; pixi task files","Reproduction entrypoints inconsistent and include invalid command path.",revision_integrator,resolved_pixi_and_protocol_entrypoints_synchronized
round1,reviewer_methods,MAJOR,"sections/06_results.tex; robotics_maze/src/benchmark.py","Timing conclusions rely on single-pass wall-clock measurements.",statistical_rigor_agent,partially_resolved_exploratory_inference_with_single_run_caveat
round1,reviewer_methods,MAJOR,"tables/main_results_table.tex; sections/06_results.tex; robotics_maze/src/benchmark.py","Path-length tie-break retained despite Theta* non-comparability caveat.",revision_integrator,resolved_path_length_removed_from_ranking_policy
round1,reviewer_methods,MAJOR,"robotics_maze/src/benchmark.py","Expansion extraction defaults can bias ranking when metric keys are missing.",revision_integrator,resolved_missing_expansions_do_not_default_to_zero
round1,reviewer_methods,MAJOR,"appendix/reproducibility_checklist.tex; coordination artifacts","Evidence traceability artifacts are stale and contradictory.",revision_integrator,resolved_coordination_artifacts_refreshed
round1,reviewer_methods,MINOR,"sections/04_method.tex; sections/05_experiments.tex","Planner-set description ambiguous about BFS baseline inclusion.",revision_integrator,resolved_benchmarked_set_and_bfs_exclusion_clarified
round1,reviewer_methods,MINOR,"coordination/figure_manifest.csv","Figure reproducibility metadata lacks script and command provenance.",main_agent,resolved_manifest_enriched_with_provenance
round1,reviewer_novelty,MAJOR,"main.tex abstract","Novelty framing unassessable because abstract is missing.",revision_integrator,resolved_publication_quality_abstract_added
round1,reviewer_novelty,MAJOR,"sections/02_introduction.tex; sections/03_related_work.tex","Contributions read as implementation hygiene rather than clear methodological novelty.",revision_integrator,partially_resolved_scope_narrowed_in_front_matter_and_discussion
round1,reviewer_novelty,MAJOR,"sections/03_related_work.tex; sections/04_method.tex","Positioning versus closest benchmark systems is asserted but not demonstrated.",revision_integrator,resolved_closest_work_delta_table_added
round1,reviewer_novelty,MAJOR,"sections/05_experiments.tex; sections/06_results.tex; sections/07_discussion.tex","Contribution scope broader than evidence from current benchmark regime.",revision_integrator,partially_resolved_claim_scope_tightened_in_experiments_and_discussion
round1,reviewer_novelty,MAJOR,"main.tex title; sections/07_discussion.tex","Overclaim risk from broad positioning relative to demonstrated scope.",revision_integrator,resolved_title_and_scope_language_narrowed_to_static_grid_benchmark
round1,reviewer_novelty,MINOR,"sections/03_related_work.tex","Related-work breadth dilutes novelty focus.",revision_integrator,resolved_related_work_pruned_to_infrastructure_scope
round1,reviewer_novelty,MINOR,"sections/02_introduction.tex","Traceable artifacts framed as primary novelty rather than expected reproducibility practice.",revision_integrator,resolved_contributions_reframed_artifacts_as_supporting_practice
round1,reviewer_novelty,MINOR,"sections/02_introduction.tex; sections/05_experiments.tex; sections/08_conclusion.tex","Executed-vs-planned boundary can read as stronger than current evidence.",revision_integrator,resolved_executed_vs_planned_boundary_reinforced
round1,reviewer_novelty,NIT,"sections/05_experiments.tex","Manuscript-production workflow figure dilutes technical emphasis.",revision_integrator,resolved_process_figure_removed_from_main_text
round1,reviewer_novelty,NIT,"main.tex IEEEkeywords","Placeholder keywords indicate unfinished positioning metadata.",revision_integrator,resolved_keywords_replaced_with_concrete_terms
round3,reviewer_methods,MINOR,"pixi.toml; robotics_maze/pixi.toml","Dependency pin mismatch across entrypoints can reduce reproducibility.",main_agent,resolved_pybullet_pin_harmonized
round3,reviewer_methods,MINOR,"robotics_maze/src/benchmark.py","Default planner set reproducibility is not fail-closed.",main_agent,resolved_canonical_12_planner_enforcement_added
round3,reviewer_methods,MINOR,"sections/06_results.tex; coordination/claims_traceability.csv","Inferential-results traceability is incomplete.",main_agent,resolved_inferential_artifact_exported_and_claims_mapped
round3,reviewer_novelty,MINOR,"sections/03_related_work.tex; tables/closest_work_delta_table.tex","Closest-work comparator set mixes direct and adjacent systems.",main_agent,resolved_direct_comparator_table_and_adjacent_note
round3,reviewer_novelty,MINOR,"sections/07_discussion.tex","Speculative hypothesis section dilutes current contribution framing.",main_agent,resolved_future_work_compressed_and_scoped
round3,reviewer_novelty,NIT,"sections/03_related_work.tex","Delta wording should emphasize integration novelty rather than component novelty.",main_agent,resolved_integration_level_novelty_sentence_added
